{
	"_id": "QfO:TreeFam-A_PPV",
	"_schema": "https://w3id.org/openebench/scientific-schemas/2.0/Metrics",
	"name": "Positive Predictive Value rate for Reference Gene Phylogenies: TreeFam-A",
	"description": "Agreement (specificity) with Reference Gene Phylogenies - TreeFam-A measured through the Positive Predictive Value (PPV) rate",
	"metrics_contact_ids": ["orcid:0000-0002-2170-853X",
            "orcid:0000-0002-9074-3507",
            "orcid:0000-0003-0019-1735",
            "orcid:0000-0002-9015-5588"],
	"formal_definition": "PPV = TP / (TP + FP)",
	"references": [
		"doi:10.1093/bib/bbr034",
		"doi:10.1093/nar/gkj118"
	]
}
