{
	"_id": "QfO:TreeFam-A_TPR",
	"_schema": "https://w3id.org/openebench/scientific-schemas/2.0/Metrics",
	"name": "True Positives Rate for Reference Gene Phylogenies: TreeFam-A",
	"description": "Agreement (sensitivity) with Reference Gene Phylogenies - TreeFam-A measured through the True Positives Rate (TPR)",
	"metrics_contact_ids": ["orcid:0000-0002-2170-853X",
            "orcid:0000-0002-9074-3507",
            "orcid:0000-0003-0019-1735",
            "orcid:0000-0002-9015-5588"],
	"formal_definition": "TPR = TP / (TP + FN)",
	"references": [
		"doi:10.1093/bib/bbr034",
		"doi:10.1093/nar/gkj118"
	]
}
